product_id,name,price,quantity,category,description,production_date,rating,status
1,Швабра,4522.0,923,Товары для дома,"Отличается устойчивостью к температурным изменениям, что облегчает хранение.",1991-08-01,0.73,New
17,Виноград,342.0,54,Фрукты,Может быть использован в качестве заменителя менее полезных продуктов.,2022-01-13,2.46,New
29,Картофель,2449.0,292,Овощи,Отличается простотой в использовании и хранении.,1996-01-10,2.98,New
51,Брюква,5847.0,965,Овощи,Отличается высокими показателями усвояемости организмом.,2015-05-06,0.87,New
88,Пакеты для библиотеки,3536.0,580,Товары для дома,"Универсальный продукт, который можно использовать в приготовлении как сладких, так и соленых блюд.",2014-04-08,3.51,New
